### ISSUE TITLE
Stuck in endless loop on noSuchName

### ISSUE THREAD

**Issue by FloydATC** [jhthorsen/snmp-effective#6]
When scanning a set of heterogeneous hosts containing switches, routers and UPSes with a set of OIDS, SNMP::Effective works fine against the switches and routers not returning any UPS data, but loops endlessly when the UPS refuses to return things like interfaces, ARP and MAC table information. The expected behaviour is to just move on. See tcpdump sample data:
12:02:58.339800 IP 10.80.8.248.58069 > 10.82.10.30.161:  GetNextRequest(311)  .1.3.6.1.4.1.318.1.1.1.11.2.6 .1.3.6.1.2.1.2.2.1.8 .1.3.6.1.2.1.2.2.1.7 .1.3.6.1.2.1.33.1.2.1 .1.3.6.1.2.1.4.22.1.2 .1.3.6.1.2.1.17.4.3.1.2 .1.3.6.1.2.1.2.2.1.1 .1.3.6.1.2.1.33.1.6.1 .1.3.6.1.4.1.9.9.68.1.2.2.1.2 .1.3.6.1.4.1.318.1.1.1.2.1.1 .1.3.6.1.4.1.9.9.46.1.3.1.1.2 .1.3.6.1.2.1.33.1.4.1 .1.3.6.1.2.1.31.1.1.1.15 .1.3.6.1.2.1.31.1.1.1.1 .1.3.6.1.2.1.31.1.1.1.18 .1.3.6.1.2.1.17.1.4.1.2 .1.3.6.1.4.1.318.1.1.1.4.1.1 .1.3.6.1.2.1.2.2.1.3
12:02:58.347208 IP 10.82.10.30.161 > 10.80.8.248.58069:  GetResponse(311)  noSuchName@1 .1.3.6.1.4.1.318.1.1.1.11.2.6= .1.3.6.1.2.1.2.2.1.8= .1.3.6.1.2.1.2.2.1.7= .1.3.6.1.2.1.33.1.2.1= .1.3.6.1.2.1.4.22.1.2= .1.3.6.1.2.1.17.4.3.1.2= .1.3.6.1.2.1.2.2.1.1= .1.3.6.1.2.1.33.1.6.1= .1.3.6.1.4.1.9.9.68.1.2.2.1.2= .1.3.6.1.4.1.318.1.1.1.2.1.1= .1.3.6.1.4.1.9.9.46.1.3.1.1.2= .1.3.6.1.2.1.33.1.4.1= .1.3.6.1.2.1.31.1.1.1.15= .1.3.6.1.2.1.31.1.1.1.1= .1.3.6.1.2.1.31.1.1.1.18= .1.3.6.1.2.1.17.1.4.1.2= .1.3.6.1.4.1.318.1.1.1.4.1.1= .1.3.6.1.2.1.2.2.1.3=
12:02:58.348089 IP 10.80.8.248.58069 > 10.82.10.30.161:  GetNextRequest(137)  .1.3.6.1.2.1.2.2.1.8 .1.3.6.1.2.1.2.2.1.7 .1.3.6.1.2.1.4.22.1.2 .1.3.6.1.2.1.2.2.1.1 .1.3.6.1.2.1.31.1.1.1.15 .1.3.6.1.2.1.31.1.1.1.1 .1.3.6.1.2.1.31.1.1.1.18 .1.3.6.1.2.1.2.2.1.3
12:02:58.354695 IP 10.82.10.30.161 > 10.80.8.248.58069:  GetResponse(151)  noSuchName@5 .1.3.6.1.2.1.2.2.1.8.1=1 .1.3.6.1.2.1.2.2.1.7.1=1 .1.3.6.1.2.1.4.22.1.2.1=ff_ff_ff_ff_ff_ff .1.3.6.1.2.1.2.2.1.1.1=1 .1.3.6.1.2.1.31.1.1.1.15= .1.3.6.1.2.1.31.1.1.1.1= .1.3.6.1.2.1.31.1.1.1.18= .1.3.6.1.2.1.2.2.1.3=
12:02:58.355105 IP 10.80.8.248.58069 > 10.82.10.30.161:  GetNextRequest(146)  .1.3.6.1.2.1.2.2.1.8.1.1 .1.3.6.1.2.1.2.2.1.7.1.1 .1.3.6.1.2.1.4.22.1.2.1.1 .1.3.6.1.2.1.2.2.1.1.1.1 .1.3.6.1.2.1.31.1.1.1.15 .1.3.6.1.2.1.31.1.1.1.1 .1.3.6.1.2.1.31.1.1.1.18 .1.3.6.1.2.1.2.2.1.3
12:02:58.362362 IP 10.82.10.30.161 > 10.80.8.248.58069:  GetResponse(154)  noSuchName@5 .1.3.6.1.2.1.2.2.1.9.1=1 .1.3.6.1.2.1.2.2.1.8.1=1 .1.3.6.1.2.1.4.22.1.3.1=255.255.255.255 .1.3.6.1.2.1.2.2.1.2.1="UM9008" .1.3.6.1.2.1.31.1.1.1.15= .1.3.6.1.2.1.31.1.1.1.1= .1.3.6.1.2.1.31.1.1.1.18= .1.3.6.1.2.1.2.2.1.3=
12:02:58.362842 IP 10.80.8.248.58069 > 10.82.10.30.161:  GetNextRequest(77)  .1.3.6.1.2.1.31.1.1.1.15 .1.3.6.1.2.1.31.1.1.1.1 .1.3.6.1.2.1.31.1.1.1.18 .1.3.6.1.2.1.2.2.1.3
12:02:58.366217 IP 10.82.10.30.161 > 10.80.8.248.58069:  GetResponse(77)  noSuchName@1 .1.3.6.1.2.1.31.1.1.1.15= .1.3.6.1.2.1.31.1.1.1.1= .1.3.6.1.2.1.31.1.1.1.18= .1.3.6.1.2.1.2.2.1.3=

(From here on, it loops until the master timeout kicks in)

12:02:58.366470 IP 10.80.8.248.58069 > 10.82.10.30.161:  GetNextRequest(77)  .1.3.6.1.2.1.31.1.1.1.15 .1.3.6.1.2.1.31.1.1.1.1 .1.3.6.1.2.1.31.1.1.1.18 .1.3.6.1.2.1.2.2.1.3
12:02:58.369809 IP 10.82.10.30.161 > 10.80.8.248.58069:  GetResponse(77)  noSuchName@1 .1.3.6.1.2.1.31.1.1.1.15= .1.3.6.1.2.1.31.1.1.1.1= .1.3.6.1.2.1.31.1.1.1.18= .1.3.6.1.2.1.2.2.1.3=

**Comment by jhthorsen** [comment]
Could you provide an example application or a snippet of how you use SNMP::Effective?

**Comment by jhthorsen** [comment]
Closing this issue because of inactivity.
